[2024-03-12 15:23:52] Ether / IP / TCP 10.30.179.41:20913 > 10.30.178.10:microsoft_ds S
[2024-03-12 15:24:03] Ether / IP / TCP 10.30.179.41:20927 > 10.30.178.10:microsoft_ds S
[2024-03-12 15:24:07] Ether / IP / TCP 10.30.179.41:20928 > 10.30.178.12:microsoft_ds S
[2024-03-12 15:24:13] Ether / IP / TCP 10.30.179.41:20930 > 10.30.178.111:microsoft_ds S
[2024-03-12 15:24:14] Ether / IP / TCP 10.30.179.41:20930 > 10.30.178.111:microsoft_ds S
[2024-03-12 15:24:14] Ether / IP / TCP 10.30.179.41:20930 > 10.30.178.111:microsoft_ds S
[2024-03-12 15:24:14] Ether / IP / TCP 10.30.179.41:20933 > 10.30.178.111:netbios_ssn S
[2024-03-12 15:24:15] Ether / IP / TCP 10.30.179.41:20930 > 10.30.178.111:microsoft_ds S
[2024-03-12 15:24:15] Ether / IP / TCP 10.30.179.41:20933 > 10.30.178.111:netbios_ssn S
[2024-03-12 15:24:15] Ether / IP / TCP 10.30.179.41:20930 > 10.30.178.111:microsoft_ds S
[2024-03-12 15:24:15] Ether / IP / TCP 10.30.179.41:20933 > 10.30.178.111:netbios_ssn S
[2024-03-12 15:24:16] Ether / IP / TCP 10.30.179.41:20933 > 10.30.178.111:netbios_ssn S
[2024-03-12 15:24:16] Ether / IP / TCP 10.30.179.41:20933 > 10.30.178.111:netbios_ssn S
[2024-03-12 15:33:26] Ether / IP / TCP 10.30.179.41:21610 > 10.30.178.111:microsoft_ds S
[2024-03-12 15:33:27] Ether / IP / TCP 10.30.179.41:21610 > 10.30.178.111:microsoft_ds S
[2024-03-12 15:33:27] Ether / IP / TCP 10.30.179.41:21610 > 10.30.178.111:microsoft_ds S
[2024-03-12 15:33:27] Ether / IP / TCP 10.30.179.41:21619 > 10.30.178.111:netbios_ssn S
[2024-03-12 15:33:28] Ether / IP / TCP 10.30.179.41:21610 > 10.30.178.111:microsoft_ds S
[2024-03-12 15:33:28] Ether / IP / TCP 10.30.179.41:21619 > 10.30.178.111:netbios_ssn S
[2024-03-12 15:33:28] Ether / IP / TCP 10.30.179.41:21610 > 10.30.178.111:microsoft_ds S
[2024-03-12 15:33:28] Ether / IP / TCP 10.30.179.41:21619 > 10.30.178.111:netbios_ssn S
[2024-03-12 15:33:29] Ether / IP / TCP 10.30.179.41:21619 > 10.30.178.111:netbios_ssn S
[2024-03-12 15:33:29] Ether / IP / TCP 10.30.179.41:21619 > 10.30.178.111:netbios_ssn S
[2024-03-12 15:35:46] Ether / IP / TCP 10.30.179.41:21866 > 10.30.178.10:microsoft_ds S
